{
	"$schema": "./theme-schema.json",
	"name": "pinkOut",
	"modelAdaptive": false,
	"vars": {
		"hotPink": "#ff69b4",
		"lightPink": "#ffb6c1",
		"deepPink": "#ff1493",
		"rose": "#ff85a2",
		"magenta": "#e056a0",
		"lavender": "#c9a0dc",
		"blush": "#ffe4e1",
		"cream": "#fff0f5",
		"gold": "#ffd700",
		"white": "#ffffff",

		"pageBg": "#1e0a14",
		"cardBg": "#2d1220",
		"surfaceBg": "#331825",
		"selectedBg": "#4a1e3a",

		"userMsgBg": "#3d1a2e",
		"toolPendingBg": "#2a1824",
		"toolSuccessBg": "#1e2a1e",
		"toolErrorBg": "#3a1820",

		"text": "#f8d8e8",
		"muted": "#b87090",
		"dim": "#8a5a6a",
		"darkGray": "#4a2a3a"
	},
	"colors": {
		"accent": "hotPink",
		"border": "rose",
		"borderAccent": "hotPink",
		"borderMuted": "darkGray",
		"success": "#a0d8a0",
		"error": "deepPink",
		"warning": "gold",
		"muted": "muted",
		"dim": "dim",
		"text": "text",
		"thinkingText": "muted",

		"selectedBg": "selectedBg",
		"userMessageBg": "userMsgBg",
		"userMessageText": "text",
		"customMessageBg": "toolPendingBg",
		"customMessageText": "text",
		"customMessageLabel": "hotPink",
		"toolPendingBg": "toolPendingBg",
		"toolSuccessBg": "toolSuccessBg",
		"toolErrorBg": "toolErrorBg",
		"toolTitle": "lightPink",
		"toolOutput": "text",

		"mdHeading": "lightPink",
		"mdLink": "lavender",
		"mdLinkUrl": "dim",
		"mdCode": "rose",
		"mdCodeBlock": "blush",
		"mdCodeBlockBorder": "rose",
		"mdQuote": "muted",
		"mdQuoteBorder": "rose",
		"mdHr": "rose",
		"mdListBullet": "hotPink",

		"toolDiffAdded": "#a0d8a0",
		"toolDiffRemoved": "deepPink",
		"toolDiffContext": "muted",

		"syntaxComment": "#b880a0",
		"syntaxKeyword": "#ff69b4",
		"syntaxFunction": "#ffd700",
		"syntaxVariable": "#ffb6c1",
		"syntaxString": "#c9a0dc",
		"syntaxNumber": "#ff85a2",
		"syntaxType": "#e056a0",
		"syntaxOperator": "lightPink",
		"syntaxPunctuation": "text",

		"thinkingOff": "dim",
		"thinkingMinimal": "muted",
		"thinkingLow": "rose",
		"thinkingMedium": "hotPink",
		"thinkingHigh": "magenta",
		"thinkingXhigh": "deepPink",

		"bashMode": "hotPink",

		"toolDiffAddedBg": "toolSuccessBg",
		"toolDiffRemovedBg": "toolErrorBg",
		"toolWarningBg": "toolPendingBg",
		"editorBg": "pageBg",
		"editorFg": "text",
		"editorCursor": "accent",
		"editorSelection": "selectedBg",
		"editorLineNumber": "dim",
		"statusBarBg": "pageBg",
		"surfaceBg": "surfaceBg",
		"cardBg": "cardBg",
		"thinkingBg": "cardBg"
	},
	"export": {
		"pageBg": "pageBg",
		"cardBg": "cardBg",
		"infoBg": "surfaceBg"
	}
}
